id,query1,query2,label
11412,请问老年人慢支肺气肿怎么治疗？,如何治疗老年人慢支肺气肿？,1
11413,三个月小孩子有肺炎可以用利巴韦林颗粒吗？,利巴韦林颗粒三个月小孩子有肺炎可以使用吗？,1
11414,为什么服用了阿胶胶囊后月经来的很多,服用了阿胶胶囊后大姨妈来的很多是咋回事,1
11415,变应性哮喘就是过敏性哮喘吗？,变应性哮喘的饮食禁忌有哪些？,0
11416,六个月的婴儿，轻微流鼻涕怎么办？,六个月的宝宝有点流鼻涕采取什么办法？,1
11417,小儿的上呼吸道感染引起的咳嗽怎么治疗？,因上呼吸道感染而引起的咳嗽怎么治疗？,1
11418,怀孕八个月能不能吃四季感冒片,怀8个月宝宝的孕妇吃四季感冒片行吗,1
11419,怀孕期间吃了感冒药会不会影响胎儿,怀孕期间不吃感冒药有什么小妙招,0
11420,外伤会导致胸膜炎吗,受了外伤能不能引发胸膜炎,1
11421,严重的慢性肺炎会传染吗?,严重的慢性肺炎的传播途径有哪些啊？,0
11422,怀孕感冒了有啥办法？？？,怀孕感冒了怎么治？？？,1
11423,全身无力酸痛没劲是怎么回事？感冒了吗？,为什么会全身无力酸痛没劲。是感冒的前兆吗？,1
11424,支原体肺炎吃什么药好?,支原体肺炎适宜服用什么药?,1
11425,肺炎链球菌性肺炎吃什么药？,肺炎链球菌性肺炎吃什么药可以治疗?,1
11426,怀孕初期感冒了对胎儿有影响吗,刚怀孕感冒对胎儿有什么伤害？,1
11427,请问肺气肿病人厌食怎么办？,肺气肿病人厌食是为什么？,0
11428,胸膜炎引起肺委缩好治吗,什么是肺委缩,0
11429,肺气肿晚期应用什么药医治,肺气肿晚期症状是什么?,0
11430,喉咙有异物感多口水如何是好？,喉咙有异物感多口水是怎么回事？,0
11431,渗透性胸膜炎结核能治好吗,渗透性胸膜炎结核需要做什么检查,0
11432,青霉素过敏的人能吃阿莫西林胶囊吗,海鲜过敏的人能吃阿莫西林胶囊吗,0
11433,乐达非热毒平颗粒用了之后会不会皮肤痒吗,乐达非热毒平颗粒能和别的中药一起喝吗,0
11434,两岁半宝宝复方鲜竹沥液一次喝20ML吗,两岁半宝宝复方鲜竹沥液一次喝多少,1
11435,变异性哮喘饮食禁忌是什么？,变异性哮喘有哪些食物不能吃,1
11436,怀孕感冒吃了感冒清有什么影响吗,怀孕感冒吃了感冒清会怎么样？,1
11437,小孩咳嗽，哮喘吃什么药最管用？,小孩咳嗽，哮喘吃什么药见效快？,1
11438,肺炎一般要治疗多久才能痊愈?,小孩肺炎会有后遗症吗,0
11439,咳嗽多久会引起肺炎呀？,咳嗽会引起肺炎吗？,0
11440,轻微肺气肿可以活四十年吗,轻微肺气肿还能活四十年吗？,1
11441,肺气肿早期咳嗽不断要如何治疗？,肺气肿早期咳嗽不断要怎么治好？,1
11442,众生丸可以治痘痘吗我不知道有没有用,请问众生丸可以治痘痘吗,1
11443,支原体肺炎一般需要几天能治好？,支原体肺炎一般多久可以治好？,1
11444,一周的时间小孩细菌性感冒能好吗,小孩细菌性感冒要多长时间才能好,1
11445,胸闷疼后背难受是胸膜炎吗,胸闷疼后背难受是胸膜炎的症状吗,0
11446,感冒头痛全身酸痛眼睛迷糊怎么回事,感冒头痛全身酸痛眼睛迷糊是什么原因,1
11447,上呼吸道感染服用什么消炎药效果好,上呼吸道感染不能吃什么药,0
11448,过敏性哮喘要注意些什么吗?,过敏性哮喘患者有哪些症状？,0
11449,咳嗽变异性哮喘能否完全治愈,咳嗽变异性哮喘什么人群会感染,0
11450,孩子得了肺炎要怎么治疗好？,孩子肺炎怎么治疗好得迅速一点?,1
11451,小儿上呼吸道感染的原因有哪些？,有哪些原因导致小儿上呼吸道感染？,1
11452,小儿支气管肺炎和支原体肺炎有什么区别？,小儿支气管肺炎有什么症状？,0
11453,你好请问百补增力丸药有什么疗效,百补增力丸药忌高血压心脏病的人服用吗,0
11454,感冒打预防针有什么作用,感冒打预防针有什么危害吗,1
11455,肺气肿应该怎么治疗，应注意什么？,肺气肿应该怎样治疗？应注意些什么呢？,1
11456,23介肺炎疫苗有必要打吗,23价肺炎疫苗必需要打吗,1
11457,老年人肺气肿的症状有哪些?,老人家肺气肿吃什么好？,0
11458,闭塞性细支气管炎与肺气肿属于同样的病吗？,闭塞性细支气管炎与肺气肿病症相同吗？,1
11459,怀孕前期感冒了怎么做才好？,怀孕前期感冒需要怎么做,1
11460,恒瑞克拉霉素缓释片的药物成分有哪些，是干什么用的,恒瑞克拉霉素缓释片是中成药吗,0
11461,治疗支原体肺炎首选哪种药为好？,哪种药治疗支原体肺炎最好？,1
11462,肺气肿影像报告怎么写？,肺气肿是什么？,0
11463,治胸膜炎用什么中成药好,治胸膜炎最好的方法,0
11464,同仁堂百补增力丸可以用来治疗哪些疾病,同仁堂百补增力丸的成分有哪些,0
11465,4岁宝宝有支气管炎反复咳嗽不好的该怎么做？,支气管炎宝宝反复咳嗽吃什么药见效快？,0
11466,我家宝宝总是咳嗽，该怎么办呢？,小孩子经常咳嗽怎么办？,1
11467,怀孕快三个月了感冒了怎么办,怀孕前吃过感冒药有影响吗？,0
11468,肺气肿感染如何推筋络？,肺气肿感染筋络要怎么推？,1
11469,银诺克利肺片选哪个生产厂家的好呢,银诺克利肺片效果好的厂家是哪个,1
11470,小孩感冒最快的办法吃什么好的快,小孩子感冒期间在饮食上不能吃什么,0
11471,请问病毒性感冒症状有哪些？,请问哪几个方面说明孩子是病毒性感冒？,1
11472,这段时间扁桃体反复发炎该怎么办呢,扁桃体发炎会引起并发症吗,0
11473,请问肺气肿有哪些治疗方法？,治疗肺气肿有什么方法？,1
11474,肺炎胸膜炎是引起的原因是什么？,肺炎胸膜炎是什么导致的,1
11475,请问为什么肺癌会造成咯血呢?,请问肺癌是如何导致咯血的？,1
11476,严重的慢性肺炎是不是会传染给家人啊,严重的慢性肺炎有传染性吗,1
11477,变异性哮喘对患者有什么影响？,变异性哮喘有什么症状？,0
11478,肺炎病毒在空气中存活多久,病毒性肺炎多久能好,0
11479,变异性哮喘会有哪些症状，严重不,变异性哮喘病是否能治？,0
11480,怀孕期间感冒了可以吃感冒药吗,怀孕期间感冒了是不是免疫力差,0
11481,请问素比伏有什么副作用吗,请问素比伏有哪些副作用,1
11482,胸闷气短是胸膜炎的症状吗,胸膜炎有哪些症状？胸闷，气短是什么病？,0
11483,肺气肿这病在家做氧疗有效果吗？,肺气肿是很严重的病吗？,0
11484,吃阿奇霉素对于治疗支原体肺炎有效吗？,治疗支原体肺炎，吃阿奇霉素管用吗？,1
11485,23介肺炎疫苗有必要打吗,23价肺炎疫苗必需要打吗,1
11486,请问孕妇感冒能吃什么药？,孕妇感冒能吃营养品吗？,0
11487,有什么办法可以预防感冒？,预防感冒吃什么水果好,0
11488,得了肺气肿会有什么危害吗？,得了肺气肿可导致什么后果？,1
11489,吸入用复方异丙托溴铵溶液该怎么用呢,吸入用复方异丙托溴铵溶液治疗什么病？,0
11490,请问下小儿肺炎的治疗方法有哪些呢？,小儿肺炎早期症状有什么呢,0
11491,请问治疗胸膜炎可以使用激素吗?,请问治疗胸膜炎可以使用哪些药物?,0
11492,医生你好流黄鼻涕67天吃了阿莫西林胶囊有效果吗,流黄鼻涕可以服用阿莫西林胶囊吗,1
11493,肺炎双球菌感染怎么治疗效果好？,肺炎双球菌感染有什么症状？,0
11494,宝宝上呼吸道感染反复发烧怎么治？,小孩反复上呼吸道感染，发烧怎么根治？,0
11495,13价肺炎疫苗是不是终身免疫?,13价肺炎疫苗有效期是多久?,1
11496,"宝宝得了肺炎,会有后遗症吗","宝宝得了肺炎,能吃中成药吗",0
11497,小儿上呼吸道感染怎么办？,怎么应对小儿上呼吸道感染？,1
11498,肺炎胸膜炎是什么引起的,肺炎胸膜炎是一种病毒吗,0
11499,小孩6岁干咳他服用复方桔梗止咳片可以吗,复方桔梗止咳片是中药还是西药呢,0
11500,得了肺炎吃什么药好的快呀？,肺炎有什么特效药？,1
11501,胸膜炎人可以喝羊奶粉吗,胸膜炎严重吗，好治疗吗？,0
11502,葫芦兄弟阿奇霉素干混悬剂不良反应大吗,服用后葫芦兄弟阿奇霉素干混悬剂会出现哪些不良反应,1
11503,感冒期间能不能喝龙牡壮骨颗粒,感冒能不能喝龙牡壮骨颗粒吗,1
11504,过敏性哮喘的治疗方法?,得了过敏性哮喘怎么办,1
11505,结核性渗出性胸膜炎的治疗方法有哪些,结核性渗出性胸膜炎严重吗,0
11506,带什么样的口罩防止肺炎病菌,肺炎链病菌是什么？,0
11507,如果上呼吸道感染，会传给家里人吗？,上呼吸道感染，怎么治疗？,0
11508,圣泰清热解毒口服液不是假的吧,圣泰清热解毒口服液是正规的吗,1
11509,儿童咳嗽变异性哮喘如何医治?,儿童咳嗽变异性哮喘怎么办?,1
11510,药店卖的阿莫西林胶囊是正品吗,阿莫西林胶囊适用于哪些人群,0
11511,如何有效治疗慢支肺气肿？,患有慢支肺气肿有什么好的治疗方法吗？,1
11512,2岁小儿可以用鼻渊通窍颗粒吗,鼻渊通窍颗粒成分是什么,0
11513,老年人肺炎症状特征是怎样的,不同年龄肺炎患者症状有什么不同,0
11514,堵塞性肺气肿和肺大泡怎么治疗,肺气肿肺大泡会治命吗,0
11515,请问肺气肿该怎么治疗好？,请问医生肺气肿怎么治疗？,1
11516,小孩吃了百令胶囊还能打预防针吗,小孩有哪些症状需要吃百令胶囊,0
11517,服用替硝唑片需要注意什么?,替硝唑片用法用量是什么呢?,0
11518,一来月经就感冒是怎么回事,一来月经就感冒可以服用玉屏风口服液吗,0
11519,宝宝有透明粘鼻涕有什么方法,宝宝有透明粘鼻涕是鼻炎吗,0
11520,口腔感染医生说是厌氧菌所致的怎么办,厌氧菌所致的口腔感染会传染吗？,0
11521,链球菌肺炎，有痛尿病用什么药好？,链球菌肺炎该怎么治疗？,0
11522,肺气肿两肺肺大泡怎么治疗,肺气肿伴有两肺肺大泡该如何治疗？,1
11523,肺炎反复发烧8天怎么治疗,病毒感冒反复发烧8天怎么办,0
11524,感冒好了后鼻孔里都是黄浓鼻涕怎么办,感冒流黄浓鼻涕可以吃双黄连吗,0
11525,感冒期间能不能怀孕请问？,感冒期间可以怀孕吗请问？,1
11526,你好，两岁多女孩去医院检查为支原体肺炎怎么治？,小孩支原体的病因是什么？,0
11527,早期肺气肿该注意什么？,早期肺气肿怎么治？,0
11528,患了肺气肿要做手术吗？,肺气肿的病需要手术治疗吗,1
11529,支原体肺炎要怎么诊断检查,"肺炎支原体,需要怎么治疗？",0
11530,鼻塞打喷嚏流鼻涕怎么办好？,鼻塞打喷嚏流鼻涕是风寒感冒吗,0
11531,孕妇感冒喝姜汤红糖水行吗,孩子感冒多吃水果蔬菜可以吗,0
11532,打喷嚏流鼻涕可以吃什么感冒药,哪种感冒药治疗打喷嚏流鼻涕,1
11533,23介肺炎疫苗有必要打吗,23价肺炎疫苗必需要打吗,1
11534,沙雷菌肺炎的症状有哪些,沙雷菌肺炎病因是什么？,0
11535,伊龙清热解毒口服液有没有假的呢,伊龙清热解毒口服液售价多少,0
11536,醋酸去氨加压素片长时间服用有没有副作用,醋酸去氨加压素片的不良反应有哪些,0
11537,慢阻肺与肺气肿有什么区别？,慢阻肺肺气肿应该要怎么治疗？,0
11538,感冒肺部感染用打点滴吗,感冒肺部感染服用什么药管用？,0
11539,间质性肺炎和肺炎的哪里不一样？,肺炎患者的症状主要是什么？,0
11540,右下肺部感染是肺炎吗?,哪类人容易肺部感染,0
11541,感冒了吃药时可以喝茶叶水吗？,感冒了吃药时茶叶水能服用吗？,1
11542,请问怀孕早期感冒对胎儿有影响吗？,怀孕感冒慢严舒柠可以吃吗？,0
11543,牙龈发炎会引发胸膜炎吗,胸膜炎能由牙龈发炎引发吗,1
11544,联邦克立安是治疗什么的啊,联邦克立安的适应症是什么？,0
11545,中医如何治疗变异性哮喘,中医怎么治疗变异性哮喘？,1
11546,怀孕期间感冒了，应该怎么办？,怀孕期间感冒了有什么护理小妙招吗,1
11547,怀孕前期感冒了怎么办？？？,怀孕前期感冒了发烧能用抗菌素吗？？？,0
11548,容易得胸膜炎的是什么人群,孕妇得了胸膜炎怎么治疗,0
11549,怀孕五个多月感冒怎么做好,怀孕五个多月感冒了有什么办法,1
11550,老人肺炎主要高烧不退怎么治疗才能根治,老人肺炎经常高烧不退怎么治,1
11551,双肺间质性肺炎怎么治疗好,双肺间质性肺炎最好的治疗方法是什么,1
11552,总是感冒流鼻涕怎么办？,总是感冒流鼻涕这可怎么治？,1
11553,怎么治疗孩子因为上呼吸道感染而引起的耳炎？,孩子因为上呼吸道感染而引起的耳炎如何治疗？,1
11554,过敏性哮喘偏方如何治疗,治疗过敏性哮喘的偏方有哪些？,1
11555,肺气肿病究竟是什么?严重吗?,肺气肿如何治疗？,0
11556,怎样分辩肺气肿早中晚期?,肺气肿早中晚期要如何分辨？,1
11557,宝宝胃肠性感冒的症状表现是什么,宝宝胃肠性感冒是细菌感染吗,0
11558,小孩肺炎饮食需要注意哪些?,三岁小孩感冒得了肺炎吃点什么药好呢？,0
11559,肺气肿会造成升主动脉增宽吗？,得了肺气肿升主动脉增宽吗？,1
11560,肺气肿感染如何推筋络？,肺气肿感染有什么症状？,0
11561,兆康金莲花胶囊的价格到底是多少,药店里面兆康金莲花胶囊的售价是多少,1
11562,老人肺气肿冬天咳嗽厉害是什么原因？,为什么老人肺气肿冬天咳嗽更厉害？,1
11563,URI-上呼吸道感染如何诊断检查,做什么检查可以诊断URI-上呼吸道感染,1
11564,双肺间质性肺炎怎么治疗好,什么是双肺间质性肺炎,0
11565,流鼻涕鼻塞怎么回事？是感冒吗？,流鼻涕鼻塞是感冒了吗？怎么办,1
11566,肺力咳合剂（健兴）适合什么样的人群服用,肺力咳合剂（健兴）有什么功效,0
11567,支原体肺炎要怎么诊断检查,如何看支原体肺炎检查报告？,0
11568,哮喘和喘息性支气管炎的区别都有什么呢？,喘息性支气管炎与哮喘有何区别？,1
11569,胸膜炎治愈后会有后遗症吗？,胸膜炎治愈后会有什么症状吗？,0
11570,什么中药可以缓解老人肺气肿？,哪些中药能调理老人肺气肿病？,1
11571,以前有肺炎现在肺经常不舒服有什么方法,曾得过肺炎现在肺经常不舒服可以怎么治疗,1
11572,哮喘怎么就突然间好了？,哮喘不能自愈吗？,0
11573,冠状病毒肺炎 血液检查,抽血可以检查出肺炎吗,1
11574,小孩长期流鼻涕是怎么回事？,小孩长期流鼻涕可以吃消炎药吗,0
11575,月子里感冒流鼻涕怎么办,月子里感冒流鼻涕有什么好法吗,1
11576,上月吃感冒药期间老婆怀孕了，有影响吗,怀孕初期吃感冒药或其他药会怎么样呢？,0
11577,刻康消炎片功能主治主要是什么呢,刻康消炎片是中成药吗,0
11578,感冒需要挂什么科,感冒挂什么科室,1
11579,请问感冒发烧肺炎怎么办？,感冒发烧肺炎如何治疗,1
11580,复方天仙胶囊可以治疗哪些病,复方天仙胶囊对哪些病有用,1
11581,宝宝一周得了支原体肺炎输了五天阿奇霉素能行吗？,支原体肺炎打阿奇霉素不见好是什么原因？,0
11582,心灵丸有什么副作用吗能否常吃呢,服用心灵丸需要注意哪些方面,0
11583,肺气肿与COPD怎么鉴别诊断,诊断肺气肿花费多吗？,0
11584,上呼吸道感染化验血能查出传染病吗,病毒性上呼吸道感染传染吗,0
11585,包裹性胸膜炎手术后还会复发吗,包裹性胸膜炎手术后会不会复发？,1
11586,想要小孩能吃尼美舒利吗,备孕期间吃尼美舒利对胎儿有什么影响,1
11587,胸膜炎一年了做什么复查？,胸膜炎一年了怎么办,0
11588,胸部喝水疼，是不是肺炎，跟咽喉炎有关系,胸部喝水疼，可能是肺炎，跟咽喉炎有关系,1
11589,上呼吸道感染咳嗽厉害吃什么药,上呼吸道感染咳嗽厉害吃什么药最有效？,0
11590,肺炎支原体抗体弱阳性是什么意思?,肺炎支原体抗体弱阳性吃什么药,0
11591,23价肺炎疫苗的注射时间,23价肺炎疫苗有必要打吗,0
11592,肺炎支原体肺炎怎么治疗,肺炎支原体感染症状是什么？,0
11593,用什么药物可以治疗过敏性哮喘..,过敏性哮喘传染吗？,0
11594,嗜麦芽黄单胞菌肺炎如何诊断检查,如何确诊嗜麦芽黄单胞菌肺炎？,1
11595,心灵丸有什么副作用吗能否常吃呢,心灵丸是高血压和心脏病的常用药吗,0
11596,喉咙有异物感多口水怎么办？,喉咙有异物感多口水吃什么药？,0
11597,肺气肿的早期症状有哪些?,肺气肿的早期如何治疗？,0
11598,孕妇用新康泰克通气鼻贴好不好,孕妇能用新康泰克通气鼻贴吗?,1
11599,怀孕五个多月感冒了怎么办,怀孕五个多月感冒怎么做好,1
11600,哺乳期感冒吃什么药好呢？,哺乳期感冒吃什么药效果好？,1
11601,肺炎支原体血清学实验阳性1:40什么情况？,肺炎支原体血清学实验怎么判断阳性,0
11602,上呼吸道感染引起耳聋耳鸣该如何治疗？,因上呼吸道感染而引起的耳聋耳鸣该怎样治疗？,1
11603,急性支气管炎治疗方法？,急性支气管炎严重吗？,0
11604,变异性哮喘，该做什么检查确诊,变异性哮喘的注意事项有什么？,0
11605,什么叫输入性新型冠状肺炎,新型冠状肺炎的症状,0
11606,感冒生病的时候能喝枸杞吗,请问感冒的时候能喝枸杞吗？,1
11607,得过胸膜炎公考报名用填写吗,公考报名用不用填写得过胸膜炎,1
11608,经常感冒是上呼吸道感染了吗,经常感冒是什么症状,0
11609,哺乳期感冒流鼻涕打喷嚏怎么办,哺乳期感冒流鼻涕是抵抗力差吗,0
11610,不到5岁小孩老是感冒怎么办？,小孩老是感冒是遗传吗,0
11611,众生丸我吃了4次了喉咙还痛啊的原因是什么？,众生丸我吃了4次了喉咙还痛是什么缘故？,1
11612,天大托恩布洛芬混悬液用量,天大托恩布洛芬混悬液标准用量是多少？,1
11613,抽烟肺炎吃盐酸左氧氟沙星有效吗？,抽烟肺炎吃盐酸左氧氟沙星有用吗,1
11614,得了小儿支原体肺炎会传染给别人吗？,得了小儿支原体肺炎会不会传染给别人？,1
11615,小儿支原体肺炎治愈后的咳嗽,支原体肺炎痊愈后还会咳嗽吗？,1
11616,宝宝需要打肺炎疫苗吗？,宝宝打肺炎疫苗都有什么反应？,0
11617,信韦灵利巴韦林气雾剂的作用效果大吗,1岁的幼儿可以用信韦灵利巴韦林气雾剂吗,0
11618,琥乙红霉素片是消炎药吗,琥乙红霉素干混悬剂是抗生素吗,0
11619,感冒打防疫针会怎么样？,感冒打防疫针会不会影响身体发育,0
11620,人冠状病毒感染的症状表现是什么,人冠状病毒感染的病因是什么,0
11621,肺气肿及肺大泡如何治疗和保养,肺气肿肺大泡可以治愈吗,0
11622,哺乳期吃了感冒药要过多久才能喂奶,哺乳期吃了感冒药什么时候可以喂奶,1
11623,克拉霉素缓释片和克拉霉素片的区别是什么,克拉霉素缓释片和克拉霉素片的作用有什么不同,1
11624,哮喘需要做什么检查确诊,哮喘病的病因是什么？,0
11625,喝酒了能吃氨基比林咖啡因片吗,氨基比林咖啡因片酒后能吃吗,1
11626,阿莫西林胶囊吃了7粒后果会怎么样,阿莫西林胶囊吃了7粒后果严重吗,0
11627,老人肺炎咳嗽吃什么药好的快,肺炎咳嗽是什么引起的,0
11628,有点流鼻涕可以打预防针吗,宝宝流鼻涕能打疫苗吗？,1
11629,用什么药物可以治疗过敏性哮喘..,可以治疗过敏性哮喘的药物有什么？,1
11630,中西药治疗感冒哪个效果好,感冒吃了药不见效是不是抵抗力差了,0
11631,你好百令胶囊是苦的还是咸的？,你好百令胶囊是苦的还是咸的？,0
11632,治疗哮喘效果最好的方法是什么？,哮喘吃什么最好？,0
11633,明兴清开灵颗粒的价格怎么样,儿童喝明兴清开灵有副作用吗,0
11634,胸膜炎可以根治吗严重吗,支气管炎，胸膜炎如何治疗？严重吗？,0
11635,怎么诊断检查支原体肺炎？,"肺炎支原体,需要怎么治疗？",0
11636,怀孕前期感冒了怎么做才好？,怀孕前期感冒需要怎么做,1
11637,请问13岁的小孩吃阿莫西林的用量是多少？,请问13岁的小孩服用阿莫西林一次时候吃多少粒？,1
11638,慢阻肺肺气肿好多年胸闷气短,慢阻肺肺气肿有什么症状？,0
11639,儿童支原体肺炎怎么治疗,孩子得了支原体肺炎要怎么治疗？,1
11640,肺炎输液用什么药比较好？,肺炎输液用哪种药比较好?,1
11641,感冒期间能怀孕吗请问？,感冒期间怀孕能吃药吗请问？,0
11642,新型冠状病毒肺炎潜伏期多久,新型冠状病毒肺炎潜伏期,1
11643,克拉霉素分散片吃多了要怎么做,克拉霉素分散片吃多了一倍怎么办？,0
11644,得了哮喘病还可以跑步锻炼吗,哮喘病晚期症状是什么？,0
11645,阿奇霉素片是治疗什么的？,阿奇霉素片的适应症有什么呢？,1
11646,葵花胃康灵胶囊哪个牌子比较好,胃溃疡可以用胃康灵胶囊效果怎么样,0
11647,肺炎胸膜炎是什么引起的,肺炎胸膜炎是什么导致的,1
11648,胸膜炎会导致蛋白流失吗？,导致蛋白流失的会是胸膜炎吗,1
11649,请问鸦胆子油软胶囊什么时候吃比较好？,请问鸦胆子油软胶囊可以和其他药一起吃吗？,0
11650,宝宝老是流鼻涕是什么原因?,宝宝为老是流鼻涕是什么原因?,1
11651,过敏性哮喘吃什么药管用,过敏性哮喘吃什么药副作用最小？,0
11652,哺乳期感冒了可以吃感冒药吗,哺乳期感冒了吃感冒药合适吗？,1
11653,胸膜炎症状反复发作是为什么,胸膜炎症状吃什么药效果好,0
11654,产前、产时感染性肺炎的症状有哪些,产前、产时感染性肺炎的症状表现是什么？,1
11655,得了肺气肿寿命还剩下几年?,肺气肿传染吗？,0
11656,产碱杆菌肺炎的症状有哪些,产碱杆菌肺炎是什么病？,0
11657,不疼的肠痉挛严重吗？,肠痉挛但是不疼没事吗？,0
11658,吃感冒药后多久可以怀孕？,吃感冒药后多长时间可以怀孕？,1
11659,你好请问达肺草有哪些作用,达肺草治感冒咳嗽吗,0
11660,感冒流鼻涕头疼发热全身出虚汗怎么回事,感冒流鼻涕头疼发热全身出虚汗是什么原因,1
11661,造成小儿支原体肺炎的原因有哪些？,引发小儿支原体肺炎的因素有哪些？,1
11662,鼻渊通窍颗粒是不是可以用来冶疗鼻咽炎的,鼻渊通窍颗粒可以用来冶疗鼻咽炎吗,1
11663,肺气肿的死亡率高不高?,肺气肿的死亡几率大不大？,1
11664,感冒为什么流的是绿色鼻涕,感冒流绿色鼻涕是什么原因,1
11665,胸膜炎症状是什么?吃什么药好?,胸膜炎症状吃什么药，可以治疗,0
11666,怀孕七个月了，感冒了怎么治疗,怀孕七个月了、感冒了怎样治疗,1
11667,3岁孩子可以服用利巴韦林泡腾颗粒的吗,3岁孩子服用利巴韦林泡腾颗粒可以吗,1
11668,怀孕期间感冒了可以打点滴吗,怀孕期间感冒对宝宝有什么影响吗,0
11669,孕妇如果服用了复方甘草口服液会有哪些症状,孕妇可以服用复方甘草口服液吗,1
11670,刻康消炎片哺乳期妇女能用吗,刻康消炎片对小孩子有害吗,0
11671,小孩感冒流鼻涕能吃那些水果？,小孩感冒流鼻涕是感冒了吗？,0
11672,肺力咳合剂效果不是很好该吃什么药,肺力咳合剂治疗小孩咳嗽效果显著吗？,0
11673,小孩咳嗽有痰还有点哮喘怎么办,小孩咳嗽痰多哮喘怎么处理？,1
11674,新生儿咳嗽是早期肺炎吗,宝宝呛奶会得肺炎吗,0
11675,肺气肿可以喝补肺丸吗？,吃补肺丸有什么副作用,0
11676,阿莫西林胶囊药店有卖的吗？,阿莫西林胶囊药店售价多高？,0
11677,大肠埃希杆菌肺炎有什么治疗方法？,大肠稀埃菌肺炎恢复期症状是什么？,0
11678,哮喘支气管炎咳嗽好多年了怎么办,哮喘支气管炎有什么症状？,0
11679,得了什么病可以吃复方天仙胶囊,复方天仙胶囊对哪些病有用,1
11680,左氧氟沙星滴眼液五个月的宝宝可以用吗？,左氧氟沙星滴眼液能给五个月的宝宝使用吗？,1
11681,葫芦兄弟阿奇霉素干混悬剂好用吗,葫芦兄弟阿奇霉素干混悬剂一盒有多少袋,0
11682,感冒流鼻涕吃什么药好？,感冒流鼻涕可以吃什么药？,1
11683,引起结核胸膜炎的是什么,结核胸膜炎能不能预防,0
11684,吃东西左胸口疼有什么好的办法能够根治吗,治疗吃东西左胸口疼的好办法是什么呢能否根治？,1
11685,结核性渗出性胸膜炎是什么病,什么是结核性渗出性胸膜炎？,1
11686,肺气肿能治好吗怎么治？,肺气肿孩子日常应当如何调理饮食？,0
11687,小孩热伤风的症状有哪些?,小孩热伤风的表现有哪些?,1
11688,请问顺尔宁能治疗支原体肺炎吗？,顺尔宁有什么副作用？,0
11689,请问患有慢支肺气肿该怎么治疗？,肺气肿，老慢支怎么治好？,1
11690,小儿复方磺胺二甲嘧啶散有什么药物功效呀,婴幼儿服用小儿复方磺胺二甲嘧啶散有什么副作用,0
