id,query1,query2,label
7432,23价肺炎疫苗要不要打,肺炎支原体无症状怎么办,0
7433,阿莫西林胶囊用法用量？,阿莫西林胶囊的一般用量是多少,1
7434,哺乳期腹股沟淋巴结肿大需要怎么治,哺乳期腹股沟淋巴结肿大怎么治,1
7435,胸膜炎复查是要照胸片吗,肺结核复发拍胸片看得出来吗？,0
7436,哮喘发作时是否需要使用抗生素,哮喘发作能用抗生素吗？,1
7437,九龙清热解毒口服液有什么作用成分,九龙清热解毒口服液售价多少,0
7438,粉尘螨滴剂和中成药一起服用会有什么危害,中成药可以和粉尘螨滴剂一起服用吗,1
7439,宝宝得肺炎好了后隔离多长时间,42岁我的皮肤发炎医生开的阿奇霉素,0
7440,上呼吸道堵塞的治疗方法有哪些,上呼吸道堵塞有哪些治疗方法,1
7441,北京哪家药店有卖洛索洛芬钠片,强直性脊柱炎可以吃洛索洛芬钠片吗效果好吗,0
7442,胸膜炎是怎么引起的炎？,急性胸膜炎是怎么引起的呢？,0
7443,上呼吸道感染:咳嗽半个月,上呼吸道感染:咳嗽有半个月了,1
7444,盐酸多西环素能否和补钙的药一同服用吗？,盐酸多西环素用来治疗什么病症？,0
7445,儿童支原体肺炎阿奇霉素吃几个疗程,儿童支原体肺炎阿奇霉素会有副作用吗？,0
7446,胸膜炎住院期间陪伴病人可以睡一快吗,怎么照顾胸膜炎患者,0
7447,用乐松治疗急性上呼吸道炎的效果如何,乐松可以治疗上呼吸道感染吗,1
7448,肺气肿的护理要怎么做？,肺气肿的护理措施？,0
7449,儿童反复上呼吸道感染怎么办？,儿童上呼吸道感染如何预防？,0
7450,米氏链球菌肺炎的症状有哪些,米氏链球菌肺炎是什么病？,0
7451,慢阻肺的诊断有标准吗？,诊断慢阻肺有一定的标准吗？,1
7452,过敏性哮喘怎么治疗才好呢?,过敏性哮喘有什么临床表现？,0
7453,感冒了吃药时可以喝茶叶水吗？,风热型感冒吃什么药好,0
7454,请问得肺气肿怎么治疗？,请问肺气肿该怎么治疗好？,1
7455,推拿能治疗小儿支原体肺炎吗？,小儿支原体肺炎有哪些症状？,0
7456,鼻塞打喷嚏流鼻涕怎么办好？,宝宝鼻塞打喷嚏流鼻涕是什么病？,0
7457,上呼吸道感染症状是怎么样的,上呼吸道感染症状有哪些,1
7458,得了哮喘，生活中有什么方法去保养啊？,哮喘病发病严重吗？,0
7459,淋巴颗粒能造成胸膜炎吗,急性淋巴颗粒该怎么用药,0
7460,慢阻肺的护理措施有哪些?,慢阻肺有哪些病症？,0
7461,得了肺炎容易致死吗,得了肺炎该注意什么？,0
7462,闭塞性细支气管炎与肺气肿一样吗,闭塞性细支气管炎与肺气肿没有什么关系？,0
7463,肺气肿的治愈方法有哪些？,怎么治愈肺气肿？,1
7464,上呼吸道感染如何保健护理,上呼吸道感染能喝酒吗,0
7465,我昨天中午吃的阿莫西林胶囊今天能喝酒吗,昨天喝酒今天能吃阿莫西林胶囊吗,1
7466,请问患了支原体肺炎顺尔宁能治疗吗,患了支原体肺炎顺尔宁可否能治疗？,1
7467,宝宝轻微肺炎有什么症状,宝宝轻微肺炎是什么引起的？,0
7468,痰多但不咳漱能吃复方桔梗怯咳片吗,复方桔梗怯咳片的主要成分有哪些,0
7469,支气管炎是上呼吸道感染吗？,支气管炎就是上呼吸道感染吗？,0
7470,肺炎咳嗽的症状是什么?,肺炎的咳嗽症状是什么样子的？,1
7471,化疗后肺癌又复发了，咳嗽厉害怎么治,肺癌化疗后复发，咳得厉害有什么办法,1
7472,六个月的婴儿，轻微流鼻涕怎么办？,六个月的宝宝有点流鼻涕采取什么办法？,1
7473,小儿支原体肺炎的症状是什么？,怎么治疗小儿支原体肺炎？,0
7474,春季如何预防宝宝上呼吸道感染？,春季宝宝上呼吸道感染了怎么办？,0
7475,宝宝为什么老是流鼻涕?,宝宝为老是流鼻涕是什么原因?,1
7476,哮喘怎么就突然间好了？,哮喘病是怎么得上的？,0
7477,为什么支气管炎哮喘的反复咳咳不见好转的呢,支气管炎哮喘和慢性支气管炎是一种病吗,0
7478,肺炎应该怎么治,肺炎能引起发烧吗,0
7479,肺气肿的早期症状是什么？,肺气肿有哪些早期的体征？,1
7480,我经常感冒是怎么回事？,我经常感冒打流感疫苗可以吗,0
7481,鼻子不通，流鼻涕，不头痛怎么办,鼻子不通，流鼻涕是鼻炎吗,0
7482,吃什么食物对变异性哮喘好,咳嗽变异性哮喘吃什么药啊？,0
7483,胸膜炎会引起脑袋胀痛吗,脑袋胀痛会发烧吗,0
7484,肺气肿能不能喝橄榄油？,肺气肿能不能喝牛奶？,0
7485,得了过敏性哮喘该怎么办,患上过敏性哮喘怎么治疗,1
7486,胸膜炎会引起反复发烧吗,结核性胸膜炎有什么特征,0
7487,严重的慢性肺炎是不是会传染给家人啊,严重的慢性肺炎有传染性吗,1
7488,上呼吸道感染引起的原因有哪些,反复上呼吸道感染，什么原因导致,0
7489,孕妇感冒吃什么药好,请问孕妇感冒有什么药可以用？,1
7490,肺气肿同肺大泡有什么区别,肺大泡和空洞的区别在哪？,0
7491,老年人患肺气肿表现有哪些?,肺气肿影响睡眠吗？,0
7492,哮喘病要怎样治疗，会传染吗？,哮喘病情跟自身抵抗力有关吗？,0
7493,哺乳期吃了感冒药要过多久才能喂奶,哺乳期吃了感冒药什么时候可以喂奶,1
7494,巨能清热解毒口服液是处方药吗,巨能清热解毒口服液是不是处方药,1
7495,怀孕期间感冒怎么办？,辛辣的食物怀孕的妈妈能吃不能,0
7496,变异性哮喘需要做哪些检查,变异性哮喘要做哪些检查项目？,1
7497,小儿支原体肺炎有什么食疗办法？,小儿支原体肺炎如何食疗？,1
7498,宝宝流鼻涕变成鼻塞怎么办才好,宝宝流鼻涕变成鼻塞怎么治疗,1
7499,宝宝吃过东西就吐，怎么治？,宝宝吃过东西就吐有什么好的办法？,1
7500,变异性哮喘需要做哪些检查,变异性哮喘有哪几种,0
7501,支原体肺炎吃转移因子胶囊可以吗,支原体肺炎会自己好吗？,0
7502,是什么引起肿瘤性胸膜炎的,肿瘤性胸膜炎严重吗,0
7503,哺乳期感冒吃什么药能好？,哺乳期感冒可以吃什么药疗效好,1
7504,怎样预防别人肺炎传染自己,如何预防肺炎传染自己,1
7505,6岁的小孩得了肺炎该怎么办,儿童得了肺炎如何治疗,1
7506,请问得肺气肿怎么治疗？,肺气肿吃什么好,0
7507,哮喘病患者还能跑步锻炼吗？,哮喘病患者能否跑步运动？,1
7508,克拉霉素缓释片是处方药吗,处方药里面有克拉霉素缓释片吗,1
7509,请问胸痛难忍低烧会不会是胸膜炎？,"发低烧,胸痛,说是胸膜炎怎么办",0
7510,过敏性哮喘适合什么运动?,过敏性哮喘能不能运动,1
7511,小孩抗肺炎支原体抗体lgm阳性怎么办,小孩抗肺炎支原体抗体lgm阳性怎么处理,1
7512,孕妇感冒了能不能喝板蓝根？,孕妇喝板蓝根能预防感冒吗,0
7513,又下肺部感染是肺炎不是,肺部感染的特征是什么,0
7514,肺气肿是什么样的病呢?,请问肺气肿是一种什么疾病？,1
7515,近期在吃达肺草痰中带血用这个效果好吗,最近吃达肺草这个药，治疗痰中有血效果怎么样,1
7516,上呼道感染服什么药效果好,上呼道感染吃什么药,1
7517,怀孕16周多感冒了有什么办法吗,怀孕16周多感冒了能吃药吗,1
7518,肺气肿加心脏早搏骤停，怎么治疗?,如何治疗肺气肿加心脏早搏骤停?,1
7519,孩子上呼吸道感染引起中耳炎怎么治疗？,孩子上呼吸道感染引起中耳炎会自己痊愈吗？,0
7520,幼儿得了肺炎可不可吃水果,幼儿肺炎可以吃鸡蛋吗,0
7521,肺气肿x线是什么意思？,肺气肿的x线表现有哪些？,0
7522,百令胶囊和补肺活血胶囊哪个好,百令胶囊和补肺活血胶囊都是中药吗,0
7523,过敏性哮喘适合什么运动?,过敏性哮喘有哪些症状,0
7524,服用缬沙坦胶囊对肾有副作用吗,缬沙坦胶囊小孩可以吃吗,0
7525,2020年新型肺炎症状,肺炎的主要症状,1
7526,6个月宝宝流鼻涕打疫苗可以吗,6个月宝宝流鼻涕能打疫苗吗,1
7527,上呼吸道感染吃什么药?,吃什么药可以治疗上呼吸道感染？,1
7528,23价肺炎疫苗打后发烧正常吗,23价肺炎疫苗打后发烧能打针吗,0
7529,怎样判断是变异性哮喘呢?,变异性哮喘应该要注意什么?,0
7530,请问，肺气肿怎么治疗呢？,请问肺气肿怎么回事怎么治疗呢？,1
7531,间质性肺炎晚期活多久？,间质性肺炎是怎样引起 的,0
7532,治胸膜炎用什么中成药好,治胸膜炎用哪种中成药好,1
7533,为什么小孩吃了富露施咳嗽更厉害了呢,多大的小孩可以吃富露施,0
7534,罗红霉素和头孢是不是可以消炎的呢,罗红霉素颗粒和头孢是不是不能喝酒呢,0
7535,肺炎双球菌感染怎么治疗效果好？,治疗肺炎双球菌感染怎样能效果好？,1
7536,铜绿假单胞菌肺炎的治疗方法是什么？,铜绿假单胞菌肺炎是怎么回事？,0
7537,结核胸膜炎在哪种情况下会发热,什么情况下结核胸膜炎会发热,1
7538,胸膜炎会导致蛋白流失吗？,蛋白流失会引发什么病,0
7539,如何区别鼻炎和上呼吸道感染?,鼻炎？上呼吸道感染？鼻炎如何缓解,0
7540,鼻子被鼻涕堵住了，怎么处理？,鼻子堵塞，吃点什么药呢？,0
7541,感冒流鼻涕头疼发热全身出虚汗怎么治,感冒流鼻涕头疼发热全身出虚汗需要多休息,0
7542,4岁宝宝有支气管炎反复咳嗽不好的呀怎么办,小孩支气管炎为什么老是反复？,0
7543,怎样才能知道自己得了哮喘病?,得了哮喘病怎么办,0
7544,呼吸机相关肺炎怎么回事,呼吸机相关性肺炎导致原因？,1
7545,孕25周，胎动突然动的很频繁,孕25周，胎动突然减弱了,0
7546,异丙托溴铵气雾剂小孩支原体肺炎能不能用,异丙托溴铵气雾剂是治疗什么疾病的？,0
7547,孕妇得了肺炎怎么办?,孕期妈妈得了肺炎怎么办?,1
7548,过敏性哮喘最佳的治疗方法是什么,过敏性哮喘需要终生吃药吗,0
7549,宝宝老是流鼻涕怎么办？,宝宝一直流鼻涕该怎么做？,1
7550,13价肺炎与23价肺炎分别是什么,13价肺炎和23价肺炎怎样区分,1
7551,哺乳期妇女感冒能吃速效伤风胶囊吗？,哺乳期妈妈感冒了，可以吃速效伤风胶囊吗？,1
7552,吃了阿莫西林胶囊能喝酒吗？,吃过阿莫西林胶囊多长时间能喝酒,0
7553,三个月宝宝鼻子呼呼响没看到鼻涕是什么情况,三个月宝宝鼻子呼呼响没看到鼻涕是不是感冒了,0
7554,如果得了肺气肿如何是好？,肺气肿能治好吗？,0
7555,怀孕五个多月感冒怎么做好,怀孕五个多月感冒了有什么办法,1
7556,胸膜炎饮食需要注意什么？,结核型胸膜炎饮食应该注意什么？,0
7557,宝宝长牙期间总是起发烧怎么回事,宝宝长牙期间发烧了怎么治,1
7558,胸膜炎急性胸部疼痛怎么缓解,胸膜炎急性胸部疼痛如何缓解,1
7559,擤鼻涕的时候感觉耳朵里面出气似的怎么了？,擤鼻涕的时候感觉耳朵里面出气似的是怎么回事？,1
7560,患了支气管炎要怎么办？,患了支气管炎如何是好？,1
7561,中药治结核胸膜炎效果好吗,中药可以治好结核胸膜炎吗,1
7562,过敏性哮喘怎么治，能去根吗,过敏性哮喘能运动吗？,0
7563,哮喘病人适宜吃什么食物？,吃什么食物对哮喘病人好呢?,1
7564,你好我家孩子嗓子发炎吃利君沙管用吗,我家小孩嗓子发炎吃什么药,0
7565,宝宝流清鼻涕，吃什么药好？,宝宝流清鼻涕可以喝葱姜水吗？,0
7566,孕妇感冒能喝可乐姜汤吗,孕妇感冒了吃感冒灵颗粒行吗,0
7567,市面上有卖假的伊龙清热解毒口服液吗,伊龙清热解毒口服液会不会买到假的,1
7568,胸膜炎饮食需要注意什么？,胸膜炎的饮食要注意什么？,1
7569,使用沙丁胺醇气雾剂有哪些副作用,喷沙丁胺醇气雾剂的副作用有哪些,1
7570,儿童反复上呼吸道感染怎么办？,儿童上呼吸道感染主要症状有哪些？,0
7571,该怎么治咳嗽变异性哮喘？,咳嗽变异性哮喘如何治疗？,1
7572,咳嗽变异性哮喘能根治吗,咳嗽是肺炎吗,0
7573,肺气肿患者为什么容易气短?,肺气肿病人该吃什么药？,0
7574,23价肺炎疫苗打需要多少钱啊?,打23价肺炎疫苗花费多少钱,1
7575,输入性新型冠状肺炎是什么,输入性新型肺炎是什么,1
7576,补肺丸治疗肺气肿吗,肺气肿吃补肺丸有用吗？,1
7577,感冒引起耳朵疼怎么办？,感冒引发耳朵疼该怎么做？,1
7578,小儿支原体肺炎如何食疗？,小儿支原体肺炎能吃什么药？,0
7579,一岁的小朋友能够服用复方甘草口服液的吗,过期的复方甘草口服液还能服用吗,0
7580,小儿上呼吸道感染的原因有哪些？,小儿急性上呼吸道感染的病因,0
7581,小孩有咳嗽反复的真是不晓得怎么好了,儿童咳嗽是什么引起的,0
7582,"擤鼻涕耳朵充气,听不见了咋办",打喷嚏耳朵充气怎样恢复,0
7583,肺炎链球菌疫苗有必要打吗,肺炎链球菌疫苗可不可以不打？,1
7584,请问肺气肿需要做手术吗？,肺气肿做手术能治好吗,0
7585,哺乳期的妈妈能否吃感冒药,浦乳期不小心感冒了，能不能吃些感冒药？,1
7586,婴儿吃感冒药拉肚子采取什么办法？,婴儿吃感冒药拉肚子怎么治？,1
7587,小儿支原体肺炎的治疗方法及治疗周期,小儿支原体肺炎怎么治需要治疗多长时间？,1
7588,小儿咽扁颗粒和罗红霉素颗粒能一起吃吗,小儿咽扁颗粒可以和小儿咳喘灵泡腾颗粒一起吃吗,0
7589,孕妇可以吃百补增力丸吗,患有高血压可以吃百补增力丸吗,0
7590,肺气肿引发心脏问题能打感冒预防针吗,肺气肿引发心脏问题打感冒预防针会加速病情恶化吗,1
7591,众生胶囊应该饭前吃还是饭后吃呀？,众生胶囊有哪些功效？,0
7592,慢性肺气肿为什么会突然转成急性肺气肿？,慢性肺气肿会导致急性肺气肿吗,0
7593,结合性胸膜炎已经半年了，什么时候会好,结合性胸膜炎已经半年了，需要多长时间会好？,1
7594,肺炎反复发烧8天怎么办,肺炎反复发烧8天怎么治疗,1
7595,怀孕期间感冒了，快速高效的治疗方法有哪几种,孕妇感冒最快治疗方法有几种,1
7596,请问四岁宝宝三天前检查出肺炎怎么办？,肺炎的症状有哪些,0
7597,"得过哮喘病的人,有哪些适合的健身方式?",哮喘病是怎么得上的？,0
7598,婴幼儿肺炎有什么症状,婴幼儿肺炎的表现是什么,1
7599,孩子经常流黄鼻涕吃什么药？,流黄鼻涕应该注意什么,0
7600,孕妇感冒了，有什么办法吗,孕妇感冒了，怎么办才好啊,1
7601,得了肺气肿能存活多久？,什么样人得肺气肿？,0
7602,小儿肺炎支原体肺炎有没有后遗症?,儿童支原体肺炎复发率高不？,0
7603,做了胸膜炎胸腔镜手术后该怎么护理,胸膜炎做胸腔镜手术后应该怎么照顾,1
7604,请问肺气肿能办慢性病门诊治疗吗？,肺气肿吃什么补品好？,0
7605,老年人得肺炎能彻底治疗好吗?,老年人肺炎传染吗？,0
7606,宝宝五个月的时候得了肺炎，咳嗽,五个月宝宝咳嗽干呕会是肺炎吗？,0
7607,新型冠状病毒感染的肺炎口罩,哪种口罩能有效预防新冠肺炎,1
7608,请问肺气肿加心脏早搏骤停怎么治疗?,肺气肿加心脏早搏骤停该怎么治?,1
7609,阿司匹林会导致哮喘吗？,阿司匹林有什么副作用？,0
7610,吃了哮喘药身上发热发抖怎么回事,吃了哮喘药身上发热发抖是怎么了？,1
7611,众生胶囊和众生丸是一样的吗,众生胶囊和众生丸是否一样？,1
7612,肺炎支原体阳性输液几天能好,肺炎支原体阳性转阴输液要多长时间,1
7613,吃感冒药后多久可以怀孕？,吃感冒药后多久不可以怀孕？,1
7614,胸膜炎发烧到38度正常吗？,胸膜炎发烧怎么降温,0
7615,九个月宝宝流鼻涕怎么办,九个月宝宝打喷嚏鼻塞怎么办,0
7616,肺炎支原体检查结果多长时间能出来？,肺炎支原体检查多久出结果？,1
7617,13介肺炎疫苗有必要打吗?,13介肺炎疫苗打完发烧怎么办,0
7618,小孩肺炎有什么好的偏方吗?,一岁多的小孩得肺炎怎么办啊？,0
7619,上呼吸道感染引起感冒嗓子发炎有痰有效的办法是什么,嗓子有痰是上呼道感染引起的吗,0
7620,心脏偶尔快速跳动是怎么了？,心脏偶尔跳的快是什么原因造成的？,0
7621,请问得肺气肿怎么治疗？,肺气肿的症状有哪些表现？,0
7622,小孩上呼吸道感染可以用什么药治疗,小孩呼吸道感染不咳嗽好不好,0
7623,支气管炎有什么最佳治疗方案？,治疗支气管炎效果最好的方法是什么?,1
7624,结核胸膜炎拍x光有用吗,结核胸膜炎x光能看出来么,1
7625,胸膜炎好了为什么还会胸疼？,胸膜炎、胸部疼痛怎么办？,0
7626,怀孕四个月孕妇可以闻风油精吗,怀孕四个月孕妇能闻风油精吗,1
7627,你好，请问月经期可以吃氨咖黄敏胶囊吗,月经期间能否服用氨咖黄敏胶囊感冒药？,1
7628,过敏性哮喘治疗偏方有什么?,治疗过敏性哮喘的偏方有哪些,1
7629,肺气肿病人吃什么食物较好?,肺气肿可治愈吗？,0
7630,孕妇感冒了能喝姜汤红糖水吗,孕妇能不能喝姜汤红糖水,1
7631,哪个牌子的达肺草疗效比较好呢,达肺草属于中草药吗,0
7632,过敏性哮喘需要怎样治疗,过敏性哮喘多久可以治疗好,0
7633,过敏性哮喘的过敏原一般是什么?,过敏性哮喘的临床症状有哪些,0
7634,变异性哮喘需要做哪些检查,变异性哮喘吃什么好？,0
7635,URI-上呼吸道感染的症状有哪些,URI-上呼吸道感染有哪些症状,1
7636,新型冠状病毒感染的肺炎症状,感染冠状病毒的潜伏期是多长？,0
7637,一来月经就感冒是咋回事,一来月经就感冒是什么原因,1
7638,支原体肺炎一般需要几天能治好？,支原体肺炎一般多久可以治好？,1
7639,益肺清化颗粒一盒装几袋能喝多长时间,益肺清化颗粒一盒有几袋能喝几天,1
7640,环球复方甘草口服溶液作用有哪些,环球复方甘草口服溶液有什么服药禁忌,0
7641,请问小儿咳喘灵口服液的正确使用方法是什么？,请问小儿咳喘灵口服液如何正确服用？,1
7642,感冒鼻塞流鼻涕打喷嚏怎么办,发烧期间的饮食小妙招是什么,0
7643,怎么解释医生说肺气肿很严重？,肺气肿治不好吗？,0
7644,过敏性哮喘怎么办才能好呢?,过敏性哮喘能根治吗,0
7645,结核胸膜炎是怎么引起的,结核胸膜炎好治吗,0
7646,细菌胸膜炎吃什么消炎药,细菌胸膜炎能吃什么消炎药,1
7647,吃了阿莫西林胶囊能喝酒吗？,吃了阿莫西林胶囊可以喝啤酒吗,0
7648,消炎药和感冒药能一起吃吗,消炎药和感冒药能不能一起吃,1
7649,肺气肿病人怎么注意饮食？,肺气肿病人平时怎么护理？,0
7650,过敏性哮喘适合什么运动?,什么运动适合过敏性哮喘患者,1
7651,得了过敏性哮喘要注意哪些问题？,得了过敏性哮喘有什么需要注意的？,1
7652,吃感冒药会影响月经推迟吗,"感冒了,吃感冒药还能大流感疫苗吗",0
7653,治好肺炎一般要治疗多长时间,肺炎多少天可以痊愈,1
7654,哺乳期感冒怎么治疗最好,哺乳期吃什么水果增强免疫力,0
7655,空气加湿器会引起肺炎吗,空气加湿器会引起什么后果,0
7656,上呼吸道感染导致病毒性感冒,病毒性感冒引起上呼吸道感染咳嗽，吃些什么,0
7657,今年冬天经常感冒怎么办呢,冬天经常感冒可以打预防针吗,0
7658,长期久坐会得胸膜炎吗？,长期久坐得胸膜炎的可能性大吗,1
7659,过敏性哮喘的过敏源有那些,过敏性哮喘治疗方法有哪些,0
7660,小儿支原体肺炎会引发脑炎吗？,小儿支原体肺炎会诱发脑炎吗？,1
7661,请问胸膜炎是怎样引起的？,请问胸膜炎怎么治疗？,0
7662,治疗肺气肿有什么方法？,有什么办法可以治疗肺气肿？,1
7663,那请问医生有胸膜炎常时间喝什么茶好呢,服用抗结核胸膜炎的药，因为便秘能喝常润茶吗？,0
7664,不到5岁小孩老是感冒怎么办？,不到5岁小孩老是发烧是抵抗力差吗？,0
7665,服用博祥新雪片后会过敏的吗,服用博祥新雪片后容易过敏呢,1
7666,肺气肿吃什么药？,老人肺气肿请问吃些啥药？,1
7667,小儿上呼吸道感染可以用哪些消炎药？,上呼吸道感染小儿可以用哪些消炎药？,1
7668,结核胸膜炎，已经腹水了,结核胸膜炎，已经腹水了，有什么好的治疗方法,0
7669,服用达肺草治疗痰喘的效果如何,请问痰喘服用达肺草的效果好吗,1
7670,打感冒预防针对肺气肿引发的心脏问题有影响吗？,肺气肿引发心脏问题后还能打感冒预防针吗,1
7671,怎样救治因药物过敏性休克的？,药物过敏性休克如何和预防？,0
7672,孩子感冒流鼻涕怎么办好呢,孩子感冒流鼻涕吃什么药,0
7673,请问肺气肿怎么有效治疗？,肺气肿要怎么治疗才好？,1
7674,小儿支原体肺炎有什么症状？,小儿支原体肺炎的病因是什么？,0
7675,肺炎支原体真的会传染吗?,肺炎支原体的危害是什么,0
7676,肺气肿应该怎么治疗，应注意什么？,初期肺气肿，有什么特效药吗？能治愈吗？应注意什么？,0
7677,要是孕妇感冒了吃什么好？？,吃什么对孕妇感冒好,1
7678,23介肺炎疫苗有必要打吗,23价肺炎疫苗必需要打吗,1
7679,克拉霉素片克拉仙的成分和功效是什么,克拉霉素克拉霉素的成分功效分别有哪些,1
7680,打喷嚏流鼻涕吃什么感冒药,打喷嚏流鼻涕的特效药,0
7681,丹参片与金银花及脑心舒能一起服用吗？,丹参片是否能与金银花及脑心舒能同服？,1
7682,流鼻涕打喷嚏咳嗽吃什么药,流鼻涕打喷嚏咳嗽吃药可以恢复？,1
7683,百利阿莫西林胶囊的功效有哪些？,百利阿莫西林胶囊的作用有哪些？,1
7684,服用达肺草有什么注意事项呢,服用达肺草的注意事项有哪些,1
7685,你好百令胶囊是苦的还是咸的？,您好百令胶囊怎么服用?,0
7686,婴儿上呼吸道感染是什么导致的？,请问婴儿上呼吸道感染是怎么造成的？,1
7687,哮喘最佳治疗方法是什么,哮喘吃什么最好？,0
7688,天大托恩布洛芬混悬液用量,天大托恩布洛芬混悬液用量多少合适？,1
7689,九个月宝宝感冒打喷嚏流鼻涕吃什药效果好,九个月孩子打喷嚏流鼻涕推荐吃什么药,1
7690,小孩能喝复方甘草口服溶液吗,复方甘草口服溶液有什么功效？,0
7691,中医可以治疗小儿支原体肺炎吗？,中医能否治疗小儿支原体肺炎？,1
7692,儿童咳嗽变异性哮喘如何医治?,咳嗽变异性哮喘饮食禁忌是什么？,0
7693,同仁堂百补增力丸可以治疗哪些疾病,同仁堂百补增力丸适用哪些疾病,1
7694,什么叫输入性新型冠状肺炎,输入性新型冠状肺炎是什么,1
7695,间质性肺炎能治愈吗,是什么引起的间质性肺炎,0
7696,扁桃体炎可以吃克拉霉素分散片吗？,扁桃体炎患者能否服用克拉霉素分散片？,1
7697,怎样确定孩子有没有得肺炎,请问您3个月宝宝如何判断有没有肺炎？,0
7698,肺炎支原体检测阴性代表什么情况?,肺炎支原体检测阴性应该怎么治,0
7699,众生丸吃了4次了我的喉咙还痛啊怎么回事,感冒喉咙痛需要服用众生丸吗,0
7700,如何判断是否患有变异性哮喘,变异性哮喘怎样护理,0
7701,奇康寒喘祖帕颗粒有效果吗,奇康寒喘祖帕颗粒的效果好吗,1
7702,怀孕了感冒喉咙痛怎么办？,在怀孕期间感冒了，嗓子痛怎么办？,1
7703,结核胸膜炎引发肠梗阻可能是腹膜炎？,如何确诊结核性胸膜炎、腹膜炎？,0
7704,乐达非热毒平颗粒用了之后会不会皮肤痒吗,乐达非热毒平颗粒用了之后皮肤会痒吗,1
7705,得了肺气肿再抽烟喝酒还能活多久？,肺气肿能抽烟吗？,0
7706,怀孕期间感冒了能打点滴吗,孕妇感冒严重能输液吗?,1
7707,一岁半的小孩不感冒老是流鼻涕怎么办呀,一岁半的小孩不感冒老是流鼻涕有什么办法,1
7708,怀孕前期感冒了怎么办？？？,怀孕前期感冒能怎么做,1
7709,肺炎咳嗽吃哪一类药好的快,肺炎咳嗽看中医还是西医,0
7710,血热月经淋漓半月还能吃断血流片吗,断血流片适应症有哪些,0
7711,胸膜炎吃什么药效果好？需要多长时间能康复？,胸膜炎怎么治疗好的快？,0
7712,想要小孩能吃尼美舒利吗,备孕期间可以吃尼美舒利吗,1
7713,过敏性哮喘有哪些偏方？,治疗过敏性哮喘的偏方是什么？,1
7714,治支原体肺炎红霉素好不好,支原体肺炎打几天红霉素能好嘛？,0
7715,请问上呼吸道消炎药有哪些？,吃消炎药能降低抵抗力吗,0
7716,得了小儿支原体肺炎，血常规正常吗？,得了小儿支原体肺炎，血常规是否正常？,1
7717,间质性肺炎能不能治好？,间质性肺炎可以治好吗,1
7718,宝宝一周得了支原体肺炎输了五天阿奇霉素可以吗,得了支原体肺炎输阿奇霉素有啥副作用？,0
7719,打喷嚏流鼻涕咳嗽吃什么药,打喷嚏流鼻涕咳嗽挂什么科室,0
7720,肺气肿加右肺肺大泡可以服用那些药？,肺气肿加右肺肺大泡要吃什么药？,1
7721,细菌性上呼吸道感染是否可服抗病毒口服液,细菌性上呼道感染是怎么引起的,0
