id,query1,query2,label
3724,擤鼻涕把耳朵堵了怎么办,我感冒了然后擤了鼻涕耳朵，感觉有点堵，怎么办？,1
3725,复方氨肽素片可以和紫丹银屑胶囊同吃吗,复方氨肽素片可以和紫丹银屑胶囊一起服用可以吗,1
3726,太儿欣罗红霉素干混悬剂用法用量是什么？,如何服用太儿欣罗红霉素干混悬剂？,1
3727,肺炎支原体抗体弱阳性是什么意思?,肺炎支原体抗体弱阳性用什么药,0
3728,23价肺炎疫苗要打几针可以呢?,打过23价肺炎疫苗应注意什么,0
3729,盐酸多西环素胶囊可以治疗梅毒吗,盐酸多西环素胶囊到底可不可以治愈梅毒,1
3730,请问顺尔宁是用于什么疾病的,请问顺尔宁有哪些适应症？,0
3731,小孩子流鼻涕是不是感冒的症状？,宝宝流鼻涕就一定是感冒了吗,1
3732,小儿支原体肺炎有什么需要注意的？,小儿支原体肺炎传染吗？,0
3733,感冒了怎样区分冷感还是热感啊,风热感冒和风寒感冒的起因是什么？,0
3734,小孩肺炎好后咳嗽多长时间能好,小孩肺炎治好后还会咳嗽多长时间,1
3735,小孩肺炎支原体阳性怎么办,孩子肺炎支原体阳性如何治疗,1
3736,肺气肿症状有哪些？,肺气肿病人最明显的表现有哪些呢?,1
3737,上呼吸道感染用什么药?,上呼道感染应该吃什么药,1
3738,服用罗红霉素会有什么不良反应,出现不良反应需要停药吗？,0
3739,陈旧性胸膜炎应注意什么,陈旧性胸膜炎应可以运动吗？,0
3740,产前、产时感染性肺炎的症状有哪些,产前、产时感染性肺炎有什么症状？,1
3741,哮喘病平时应该注意什么?,得了哮喘病平时应该注意哪些问题？,1
3742,哪种口罩能有效预防新冠肺炎,新冠肺炎带什么口罩比较合适,1
3743,石家庄清热解毒软胶囊哪个牌子比较好,石家庄清热解毒软胶囊是医保药吗,0
3744,胸膜炎半年后每天喝点红酒行吗,胸膜炎半年能要孩子吗,0
3745,请问气紧胸闷肺气肿怎么办？,肺气肿胸闷气短怎么办？,1
3746,如何正规治疗小儿支原体肺炎,小儿支原体肺炎的后果是什么？,0
3747,肺气肿，双肺大泡.请问怎么治疗?,怎么治疗肺气肿双肺大泡？,1
3748,请问胸膜炎伴积水是不是严重？,请问胸膜炎伴积水如何治疗,0
3749,过敏性哮喘的症状有哪些？,过敏性哮喘病的病因是什么？,0
3750,2019年新型肺炎症状,新型肺炎咳嗽吗,0
3751,婴儿吃感冒药拉肚子怎么办？,婴儿吃感冒药拉肚子可以吃小儿复方胰酶散吗,0
3752,请问屁股皮肤痒可以吃克拉霉素分散片吗？,过敏能吃克拉霉素分散片吗,0
3753,结合性胸膜炎已经半年了，什么时候会好,结合性胸膜炎已经半年了，多久能好？,1
3754,过敏性哮喘会不会导致死亡,过敏性哮喘能不能引发生命危险致人死亡,1
3755,阿莫西林有消炎的功效吗,阿莫西林没有什么作用？,0
3756,请问肺气肿复发率高吗？,肺气肿为什会反复发作？,0
3757,一直流鼻涕怎么做才好,总是流鼻涕应该怎么办,1
3758,感冒不吃药能好吗？,嗓子疼不吃药多喝水能好吗,0
3759,哺乳期感冒怎么办最有效,喝葱姜水治哺乳期感冒吗,0
3760,请问利君沙和甲硝唑吃完有会药物反应吗,利君沙和甲硝唑分别治疗什么,0
3761,新博柴黄颗粒现在的售价是多少,药店可以买到新博柴黄颗粒吗大概多少钱,1
3762,匹多莫德分散片什么情况下可以吃,过敏体质的人可以吃匹多莫德分散片么,0
3763,儿童变异性哮喘怎么办？,如何诊断儿童咳嗽变异性哮喘？,0
3764,玉屏风颗粒能预防感冒吗,玉屏风颗粒能治感冒吗,0
3765,复方甘草口服溶液如果孕妇食用了会怎么样,复方甘草口服液一盒多少支,0
3766,宝宝一周得了支原体肺炎输了五天阿奇霉素可以吗,支原体肺炎打阿奇霉素不见好是什么原因？,0
3767,过敏性哮喘有哪些治疗的偏方？,过敏性哮喘常规治疗方法有哪些,0
3768,克拉霉素缓释片是处方药吗,克拉霉素缓释片和西沙比利同时服用致命吗,0
3769,胸膜炎患者康复后可多喝苦菜泡茶吗,胸膜炎患者康复后多喝苦菜泡茶可以吗,1
3770,新型肺炎确诊病例首现9个月婴儿,新型肺炎确诊婴儿,1
3771,儿子是支原体肺炎医生开了博利康尼是吗,儿子是支原体肺炎医生开了博利康尼管用吗？,1
3772,肺气肿病人吃什么食物较好?,肺气肿吃什么中药？,0
3773,双肺间质性肺炎应如何治疗,双肺间质性肺炎最好的治疗方法是什么,1
3774,胸膜炎严重吗会有什么表现,胸膜炎严重吗症状有哪些？,1
3775,肺气肿接着抽烟会造成什么后果？,肺气肿能抽烟吗？,0
3776,肺炎好了右胸痛怎么处理？,肺炎好了右胸痛怎么治疗？,1
3777,请问肺气肿复发率高吗？,肺气肿可治愈吗,0
3778,新型肺炎进入第二次流行上升期,我这个肺炎严重吗？,0
3779,得了哮喘有哪些方法保养？,哮喘有哪些治疗保养方式？,1
3780,小孩打完预防针就感冒了能吃药吗,小孩吃了感冒药可以打预防针吗？,0
3781,大姨妈期间感冒了能不能打针,来月经感冒了不流鼻涕是鼻炎吗,0
3782,请问肺炎是怎样引起的？,请问肺炎如何治疗,0
3783,过敏性哮喘应该注意哪些问题?,过敏性哮喘适合什么运动,0
3784,肺炎支原体肺炎如何治疗？,怎么治疗肺炎支原体肺炎？,1
3785,过敏性哮喘平时应注意哪些问题？,过敏性哮喘病的病因是什么？,0
3786,肺炎的症状有哪些症状？,小孩肺炎的早期症状有哪些?,1
3787,孕妇感冒可以喝小柴胡颗粒吗,孕妇感冒是免疫力低的原因吗,0
3788,什么是肺气肿肺气肿的症状有哪些,肺气肿是怎么定义的？有哪些症状？,1
3789,肺力咳合剂效果不是很好该吃什么药,孩子上火引起咳嗽吃什么药比较好？,0
3790,新型冠状肺炎发烧多少度,肺炎一般发烧多少度,1
3791,婴幼儿上呼吸道感染的症状是什么？,上呼吸道感染婴幼儿有哪些症状？,1
3792,肺炎支原体抗体1:40阴性正常吗,产前、产时感染性肺炎的治疗方法有哪些,0
3793,吃了哮喘药身上发热发抖是怎么了？,吃了哮喘药身上发热发抖是什么原因？,1
3794,治疗过敏性哮喘比较好的方法怎么治,怎么治疗过敏性哮喘比较好,1
3795,上呼吸道感染症状严重吗?,上呼吸道感染引起的小儿咳嗽怎么治疗？,0
3796,感冒后为什么耳朵发烧变红,为什么感冒后耳朵会发烧变红,1
3797,喉康散可以给儿童使用吗,18个月的孩子可以用喉康散吗,1
3798,氢溴酸右美沙芬糖浆怎么样啊,氢溴酸右美沙芬糖浆效果如何,1
3799,宝宝流清鼻涕，吃什么药好？,宝宝流清鼻涕是鼻炎？,0
3800,感冒流绿色的鼻涕是怎么回事？,感冒为什么流的是绿色鼻涕,1
3801,请问肺气肿病人厌食怎么办？,肺气肿病人需注意什么,0
3802,胸膜炎是什么症状?吃什么药好?,胸膜炎有哪些症状?吃什么药好?,1
3803,克拉霉素缓释片和克拉霉素片的区别是什么,克拉霉素缓释片和克拉霉素片的功效有什么不同,1
3804,怀孕2个月感冒了，怎么办啊？,怀孕2个月感冒了有什么办法,1
3805,怀孕21周，感冒了怎么办？,怀孕21周，感冒了可以吃盐蒸橙子吗？,0
3806,请问患有慢支肺气肿该怎么治疗？,如何有效治疗慢支肺气肿？,1
3807,吃了阿莫西林胶囊能喝酒吗？,吃了阿莫西林胶囊可以喝酒吗,1
3808,小孩上呼吸道感染反复发烧怎么办,小孩上呼吸道感染反复发烧怎么处理,1
3809,婴幼儿支原体肺炎感染能治好吗,婴儿支原体肺炎的症状有哪些？,0
3810,巨能清热解毒口服液价格是多少怎么卖,巨能清热解毒口服液多少钱一盒便宜吗,1
3811,23价肺炎疫苗需要多少钱,打一次23价肺炎疫苗用多少钱,1
3812,肺炎引起的高烧不退怎么处理?,肺炎导致的发烧不退怎么办,1
3813,硫酸沙丁胺醇吸入气雾剂老人可以用吗,硫酸沙丁胺醇吸入气雾剂的注意事项是什么？,0
3814,得了肺气肿会传染给家吗,患有肺气肿能传染给家人吗？,1
3815,胸膜炎吃什么药好用，我是开大货车,胸膜炎是什么症状？,0
3816,如何确认新型冠状性肺炎,下肺炎症，冠状动脉粥样硬化,0
3817,一月龄婴儿打喷嚏流浓鼻涕怎么办,宝宝刚满月老是打喷嚏流脓鼻涕怎么办才好,1
3818,孩子细菌性感冒该用些什么药,孩子细菌性感冒能吃什么药,1
3819,排卵期感冒了吃药了能要孩子吗?,排卵期感冒了怎么办,0
3820,感冒咳嗽会不会咳成肺炎？,感冒一直咳嗽会是肺炎吗？,0
3821,早产儿感冒怎么办，时间就一个月了,早产儿现在刚一个月感冒了该怎么治疗啊？,1
3822,干性胸膜炎能否传染？和注意事项..,干性胸膜炎是否传染？,0
3823,经常感冒是怎么引起的啊？,经常感冒是怎么回事啊？,1
3824,怀孕期间感冒一直不好有什么办法吗,怀孕期间感冒一直不好该咋办,1
3825,得了过敏性哮喘怎么治？,怎么治疗过敏性哮喘比较好,1
3826,胸膜炎治疗不当会产生什么后果,胸膜炎治疗不当有什么补救方法吗？,0
3827,布洛芬混悬液吃多了如何让处理？,小儿退烧药吃过量了有什么后果吗？,0
3828,胸膜炎活动时疼痛会加重吗,胸膜炎活动时疼痛有加重的机率吗？,1
3829,喉康散刚刚满2周岁的小孩能使用吗,喉康散主治什么病,0
3830,肺气肿病人不想吃东西怎么办,肺气肿有什么症状？,0
3831,宝宝流鼻涕是感冒了吗？,宝宝流鼻涕需要吃药吗？,0
3832,哺乳期感冒了能吃感冒药吗,哺乳期感冒了可不可以吃感冒药？,1
3833,链球菌肺炎，有痛尿病适宜服用哪种药？,链球菌肺炎，有痛尿病该用怎样的药好？,1
3834,感冒打预防针有什么影响,打预防针后感冒了能服药吗,0
3835,上呼吸道感染是什么原因导致的,上呼道感染的主要诱因是什么,1
3836,发烧了喝巨能清热解毒口服液有副作用,巨能清热解毒口服液有效期多长时间,0
3837,3岁孩子可以服用利巴韦林泡腾颗粒的吗,利巴韦林泡腾颗粒适用人群有哪些,0
3838,哪种口罩能有效预防新冠肺炎,新冠肺炎带什么口罩比较合适,1
3839,治疗肺气肿的特效药有哪些,治疗肺气肿的药物有哪些药？,1
3840,胸闷疼后背难受是胸膜炎吗,胸闷疼后背难受是什么原因呢,0
3841,请问中耳炎会使上呼吸道感染吗?,请问中耳炎能使上呼吸道严重感染吗？,0
3842,剧烈运动后喝水为什么会得胸膜炎,为什么剧烈运动后喝水会得胸膜炎,1
3843,13肺炎疫苗多少钱一针,肠球菌肺炎的病因是什么,0
3844,宝宝有透明粘鼻涕怎么办,宝宝有透明粘鼻涕是鼻炎吗,0
3845,两个月婴儿肺炎的早期症状,怎么判断新生儿是否是早期肺炎,1
3846,宝宝2岁上呼吸道感染反复发烧该怎么办,宝宝2岁上呼吸道感染反复发烧该怎么治疗,1
3847,连续剧烈无痰干咳怎么治疗能彻底康复呢,干咳无痰吃什么水果恢复的快,0
3848,圣泰清热解毒口服液对什么疾病有效果,圣泰清热解毒口服液价格贵吗,0
3849,变异性哮喘要吃什么药?,变异性哮喘可以吃什么药?,1
3850,怎么样预防肺气肿的发生？,肺气肿要怎么预防呢？,1
3851,小孩感冒鼻塞流鼻涕怎么办才好啊?,小孩感冒一直流鼻涕怎么办,1
3852,胸膜炎复查需要拍CT吗,胸膜炎复查前能吃饭吗,0
3853,怎么会得肺气肿？,肺气肿常见症状有什么？,0
3854,服用伊龙清热解毒口服液后皮肤会发红的吗,上火了喝伊龙清热解毒口服液有效吗,0
3855,过敏性哮喘应该注意哪些问题?,过敏性哮喘的症状有哪些,0
3856,阴囊发凉有潮湿现象晚上感觉明显怎么办？,阴囊发凉有潮湿现象晚上感觉明显是什么原因？,0
3857,两岁半宝宝用复方异托溴铵做雾化的用量是什么？,复方异托溴铵做雾化适合新生儿服用吗？,0
3858,乐达非热毒平颗粒用了之后会皮肤痒吗,乐达非热毒平颗粒用了之后会不会皮肤痒吗,1
3859,过敏性哮喘的治疗方法有多少,过敏性哮喘都有是啥治疗方法,1
3860,晕车可以吃三九感冒灵吗,晕车不能吃什么药,0
3861,全身无力酸痛没劲是怎么回事？感冒了吗？,全身无力酸痛没劲是怎么回事？是不是感冒了,1
3862,经常感冒是怎么引起的啊？,经常感冒吃什么增加抵抗力？,0
3863,大动脉手术有引起胸膜炎的可能吗,大动脉手术需要注意什么,0
3864,感冒最主要的传播途径是什么,感冒吃什么药最好？,0
3865,阿莫西林胶囊能用来治疗伤口吗,可以用阿莫西林胶囊治疗伤口吗,1
3866,反复发高烧基于这样的情况越想越担心,孩子反复发烧很担心怎么办,1
3867,贞芪扶正颗粒可以辅助治疗胸膜炎吗,贞芪扶正颗粒有什么作用,0
3868,得了过敏性哮喘要注意些什么？？？谢谢,过敏性哮喘病的病因是什么？,0
3869,宝宝得了肺炎如何治疗,宝宝得了肺炎怎样治疗,1
3870,如何处理大咯血?,大咯血该怎么处理?,1
3871,怀孕前期感冒了怎么做才好？,怀孕前期感冒需要怎么做,1
3872,宝宝五个月的时候得了肺炎，咳嗽,五个月宝宝咳嗽三天会不会是新型肺炎,0
3873,支原体肺炎一般需要几天能治好？,支原体肺炎一般多久可以治好？,1
3874,咳嗽变异性哮喘如何治疗？,如何诊断儿童咳嗽变异性哮喘？,0
3875,阿莫西林胶囊孕妇能吃吗,阿莫西林有耐药性吗,0
3876,问一下头孢丙烯干混悬剂一岁宝宝能吃吗,问一下头孢丙烯干混悬剂适宜一岁宝宝吃吗？,1
3877,服用众生丸忌吃什么吗？,众生丸的注意事项有哪些呢？,0
3878,问下治支原体肺炎红霉素好不好,治疗支原体肺炎用阿奇好还是红霉素好？,0
3879,消炎药和感冒药一起吃可以吗,消炎药和感冒药一起吃有什么影响,1
3880,肺气肿的检查项目有哪些？,肺气肿患者需要做什么检查？,1
3881,抵抗力差容易感冒能吃什么,抵抗力差容易感冒可以吃什么,1
3882,新型冠状病毒性肺炎症状,病毒性肺炎吃什么药好,0
3883,儿子是支原体肺炎医生开了博利康尼是吗,儿子是支原体肺炎医生开了博利康尼有效果吗？,1
3884,刚怀孕，感冒了怎么办？,怀孕期间感冒一直不好对宝宝有影响吗,0
3885,13肺炎疫苗多少钱一针,23价肺炎疫苗需要多少钱,0
3886,肺炎引起的胸膜炎该怎么办,肺炎会引起其他病吗,0
3887,阿奇霉素片有什么功效的呢？,九台市治疗肺炎哪个医院好？,0
3888,恒瑞克拉霉素缓释片的作用成分是什么药物,恒瑞克拉霉素缓释片的厂家在哪里,0
3889,怀孕期间感冒一直不好怎么办,怀孕期间感冒一直不好对宝宝有影响吗,0
3890,过敏性哮喘还能活多久啊?,过敏性哮喘影响怀孕吗,0
3891,过敏性咳嗽会引起哮喘吗？,过敏性咳嗽会诱发哮喘吗？,1
3892,罗红霉素和头孢是不是可以消炎的呢,消炎药有哪些？,0
3893,大肠埃希杆菌肺炎的治疗方法有哪些,大肠埃希杆菌肺炎治疗方法是什么？,1
3894,咳嗽是新冠肺炎吗,感冒咳嗽转肺炎，吃什么药,0
3895,流鼻涕鼻塞怎么回事？是感冒吗？,流鼻涕鼻塞有什么办法？是不是感冒了？,1
3896,怀孕初期会有感冒症状吗,怀孕初期怎样预防发烧,0
3897,打23介肺炎疫苗有什么好处,23介肺炎疫苗有没有打的必要？,1
3898,老人能用硫酸沙丁胺醇吸入气雾剂吗？,硫酸沙丁胺醇气雾剂适合老人哮喘使用吗？,1
3899,老人肺气肿冬天咳嗽厉害是什么原因？,为什么老人肺气肿冬天咳嗽更厉害？,1
3900,感冒鼻塞流鼻涕打喷嚏怎么办,感冒是怎么引起的,0
3901,肺气肿反复发作平时该怎么预防,肺气肿治愈还会复发吗？,0
3902,孕妇感冒可以喝红糖煮姜水吗,孕妇感冒鼻子不通有小妙招吗,0
3903,胸膜炎疼和乳腺疼怎么区别,如何区别胸膜炎疼和乳腺疼？,1
3904,患了胸膜炎正在吃药治疗能喝酒吗,胸膜炎病人有什么需要注意的事项？,0
3905,在徐州云龙区哪里有卖雷氏大补阴丸的呢,徐州云龙区哪里有售雷氏大补阴丸的,1
3906,变异性哮喘的症状有哪些?,变异性哮喘的表现有哪些,1
3907,吃完清肺散结丸一个疗程后吐的痰粘吗,服用清肺散结丸一个疗程后吐的痰还粘吗,1
3908,多年的肺气肿怎样食疗能好,肺气肿的后遗症有哪些？,0
3909,伊龙清热解毒口服液作用效果大吗,哺乳期上火可以服用伊龙清热解毒口服液吗,0
3910,小孩子常用阿奇霉素有什么副作用,小孩子常用阿奇霉素有什么不良反应？,1
3911,经常感冒流鼻涕，是什么原因？,为什么感冒就一直流鼻涕,1
3912,孕妇有丹毒可以服用克拉霉素分散片吗,孕妇怎么吃克拉霉素分散片,0
3913,青少年肺炎如何治疗最好?,患上肺炎为什么不能平躺着睡觉,0
3914,我经常反复性的感冒流鼻涕是什么原因,我经常反复性的感冒流鼻涕和鼻炎有关系吗,0
3915,新型冠状病毒肺炎传播途径,肺炎会传染人吗,0
3916,发烧，咽痛，有痰咳嗽上呼吸道感染,发烧，咽痛，有痰咳嗽上呼吸道感染怎么治疗,1
3917,上呼吸道感染用什么药?,什么药治疗上呼道感染,1
3918,婴儿上呼吸道感染是什么引起的,婴儿上呼吸道感染，会有什么症状呢,0
3919,用什么消炎药对胸膜炎肺炎好,胸膜炎肺炎好治疗吗,0
3920,立先裸花紫珠胶囊有什么样的功效效果好吗,立先裸花紫珠胶囊的疗效好吗,1
3921,孕妇感冒了，该怎么办啊？,孕妇感冒了有什么药注意的？,0
3922,胸膜炎的症状该吃什么药,胸膜炎症状要怎样冶吃什么药,0
3923,打喷嚏流鼻涕吃什么感冒药,宝宝打喷嚏流鼻涕能喝感冒灵吗,0
3924,刻康消炎片哺乳期妇女能用吗,刻康消炎片哺乳期的妈妈能用吗,1
3925,请问孩子肺炎怎么治疗？,儿童肺炎可以吃抗生素吗,0
3926,感冒并发腰痛、全身刺痛怎么回事,感冒并发腰痛、全身刺痛这是怎么啦？,1
3927,阿莫西林胶囊的常规用量,阿莫西林胶囊的一般用量是多少,1
3928,孩子上呼吸道感染可以吃那种药,孩子上呼吸道感染挂什么科室,0
3929,复方甘草口服溶液具体用法用量是多少,喉咙有痰可以喝复方甘草口服溶液吗,0
3930,胸膜炎活动时疼痛会加重吗,胸膜炎活动时疼痛有加重的可能性吗？,1
3931,"嗓子疼上不来气,流黄鼻涕怎么回事",喉咙痛鼻涕黄是怎么一回事？,1
3932,反复发高烧基于这样的情况越想越担心,反复发烧是什么意思,0
3933,哮喘病人吃什么食物好呢?,哮喘应该怎么预防？,0
3934,请问肺气肿加心脏早搏骤停怎么治疗?,肺气肿加心脏早搏骤停，怎么治疗?,1
3935,请问孕妇感冒吃什么药好,孕妇感冒吃水果好吗？,0
3936,小孩抗肺炎支原体抗体lgm阳性怎么办,小孩抗肺炎支原体抗体lgm阳性是得的什么病,1
3937,老人肺气肿冬天咳嗽的更厉害的原因是什么？,是不是肺气肿病人冬天咳嗽得厉害,0
3938,冠状病毒感染的症状有哪些？,怎么治疗人冠状病毒感染,0
3939,肺气肿的治愈方法有哪些？,怎么治愈肺气肿？,1
3940,4岁上呼吸道感染低烧不退怎么办,5岁低烧不退是病毒性感冒吗,0
3941,我老公好像得了过敏性哮喘怎么办,什么是过敏性哮喘？,0
3942,要是孕妇感冒了吃什么好？？,要是孕妇感冒了能吃什么？？,1
3943,小儿肺炎支原体抗体弱阳性？,儿童肺炎支原体抗体弱阳性严重吗？,0
3944,老年人吃百令胶囊能喝鸽子汤吗？,老年人吃百令胶囊能起作用吗？,0
3945,小儿支原体肺炎食疗是怎么样的？,小儿支原体肺炎有什么食疗办法？,1
3946,左氧氟沙星滴眼液能给五个月的宝宝使用吗？,喝酒后能用盐酸左氧氟沙星滴眼液吗？,0
3947,得过肺炎的老人能否接种23价肺炎疫苗？,得过肺炎的老人怎么治？,0
3948,支气管炎哮喘的反复咳咳不见好转是怎么回事,支气管炎哮喘的反复咳咳不见好转是什么原因,1
3949,日诺清热解毒口服液的价格是多少,日诺清热解毒口服液多少钱,1
3950,请问肺炎是怎样引起的？,肺炎患者饮食要注意什么,0
3951,阿莫西林胶囊吃了7粒后果会怎么样,阿莫西林胶囊吃了7粒会不会拉肚子啊,0
3952,过敏性哮喘的治疗方法有多少,过敏性哮喘都有是啥治疗方法,1
3953,肺气肿常见症状有什么？,常见的肺气肿症状表现有哪些啊?,1
3954,嗜麦芽黄单胞菌肺炎如何诊断检查,嗜麦芽黄单胞菌肺炎是什么？,0
3955,支气管堵塞会引起胸膜炎吗,引起胸膜炎会是支气管堵塞吗？,1
3956,牙龈发炎会引发胸膜炎吗,牙龈发炎红肿有什么小妙招,0
3957,"怀孕初期吃了感冒药,孩子能要吗","怀孕初期吃了感冒药,孩子能不能要吗",1
3958,肺气肿呼吸困难，气短，乏力该做什么？,肺气肿呼吸困难是怎么回事？,0
3959,肺炎支原体真的会传染吗?,肺炎支原体会不会传染,1
3960,小孩肺炎一定要输液才会好吗？,小儿肺炎用输液吗,1
3961,胸膜炎后遗症吃什么中药,胸膜炎后遗症应该吃哪种中药,1
3962,百令胶囊的用法用量,长期服用百令胶囊有什么危害,0
3963,明兴清开灵颗粒的价格贵吗,明兴清开灵颗粒的价格一般人可以接受吗,1
3964,胸膜炎饮食需要注意什么,胸膜炎患者会不会传染下一代,0
3965,体质不好容易感冒怎样治？,体质弱容易感冒怎么办？,1
3966,得了过敏性哮喘怎么治？,怎么治疗过敏性哮喘比较好,1
3967,我感到鼻子堵喉咙痒咳嗽吃点罗红霉素行吗,鼻子堵喉咙痒咳嗽是感冒吗,0
3968,什么是支原体小儿肺炎？,支原体小儿肺炎有哪些症状？,0
3969,感冒鼻塞流鼻涕吃什么药,宝宝感冒鼻塞流鼻涕吃什么药,0
3970,孕妇感冒好长时间也没痊愈，怎么回事,孕妇感冒可以多喝白开水,0
3971,小儿支原体肺炎治疗方法有哪些？,治疗小儿支原体肺炎方法是什么？,1
3972,怀孕感冒了有啥办法？？？,怀孕感冒了怎么治？？？,1
3973,化脓性胸膜炎会传染吗？,化脓性胸膜炎怎么治疗,0
3974,感冒喉咙痛吃什么水果好,感冒喉咙痛什么水果可以吃,1
3975,如何确诊新型冠状肺炎,拍片，右上肺感染，主动脉及冠状动脉硬化，是不是肺炎,0
3976,患有变异性哮喘需要注意的地方有什么呢？,变异性哮喘吃什么药好,0
3977,慢阻肺与肺气肿这两种疾病有什么区别？,慢阻肺和肺气肿的不同体现在哪里,1
3978,服用罗红霉素会有什么不良反应,罗红霉素引起的不良反应怎么处理？,0
3979,婴儿吃阿奇霉素会引起吐奶吗？,阿奇霉素能治好小儿支原体肺炎吗？,0
3980,小儿支原体肺炎怎么护理？,小儿支原体肺炎是如何护理的？,1
3981,丹参片能与金银花及脑心舒能同服吗,丹参片是否能与金银花及脑心舒能同服？,1
3982,粘连性胸膜炎怎么治疗?,干性胸膜炎右侧轻度粘连复发怎么办？,0
3983,宝宝上呼吸道感染吃什么药,宝宝上呼吸道感染吃那种药?,1
3984,胸膜炎可以治疗嘛？,胸膜炎有什么症状？,0
3985,请问：我为什么经常感冒？,我为什么总是发烧不感冒,0
3986,请问依托红霉素颗粒能治疗干咳吗,你好依托红霉素颗粒能治疗干咳吗,1
3987,变异性哮喘什么方法治疗最好？,变异性哮喘症状是什么,0
3988,孕妇感冒了能喝板蓝根吗？,孕妇感冒了能吃什么药,0
3989,过敏性哮喘会不会引发生命危险,过敏性哮喘能不能引发生命危险致人死亡,1
3990,结核性渗出性胸膜炎的治疗方法有哪些,结核性渗出性胸膜炎有哪些治疗方法,1
3991,婴儿上呼吸道感染是什么导致的？,请问婴儿上呼吸道感染是怎么造成的？,1
3992,新型冠状病毒感染的肺炎有哪些症状,人冠状病毒感染的病因是什么,0
3993,感冒打预防针有什么作用,感冒打预防针有什么危害吗,1
3994,治疗胸膜炎的方法有哪些,胸膜炎能吃什么食物？,0
3995,过敏性哮喘患者的注意事项是什么？,过敏性哮喘患者要注意的是什么？,1
3996,服用阿莫西林胶囊应注意什么,吃阿莫西林需要注意哪些问题,1
3997,小孩上呼吸道感染应该怎么做,宝宝患上呼吸道感染怎么治疗,1
3998,过敏性哮喘的治疗方法有哪些?,过敏性哮喘病的病因是什么？,0
3999,孕妇感冒吃什么药好,请问孕妇感冒有什么药可以用？,1
4000,治疗胸膜炎的方法有哪些,治疗胸膜炎有哪些方法？,1
4001,怀孕23周6天，感冒了怎么办？,怀孕23周6天，感冒了能吃中成药吗？,0
4002,青霉素过敏的人吃阿莫西林胶囊行吗,青霉素过敏的人可以吃阿莫西林胶囊吗,1
4003,治疗急性支气管炎有什么方法？,急性支气管炎严重吗？,0
4004,肺气肿可服用哪些药物？,肺气肿能治好吗？,0
4005,肝癌兼肺癌晚期能活多久？,肝癌兼肺癌晚期能治好吗？,0
4006,肺力咳合剂（健兴）适合什么样的人群服用,肺力咳合剂（健兴）效果怎么样,0
4007,肺气肿早期咳嗽不断要如何治疗？,肺气肿早期咳嗽不断要怎么治好？,1
4008,小孩刚打完预防针感冒可以吃药吗？,小孩打完预防针感冒了吃药可以吗,1
